<?xml version="1.0" encoding="UTF-8"?>
<data xmlns:xsi="http://www.w3.org/2001/XMLSchema-instance" xsi:noNamespaceSchemaLocation="WildTalentsCharacterCreator.xsd" version="1">

  <!-- 
    Notes 
    * all elements have a
      * id - unique identifier, optional
      * ref- reference for lookups, can have duplicates, optional
      * name - display name, optional
    * ref or id used when linking elements together
    * cost for stats and skills doesn't include Native modifier 
  -->

  <config-sets chosen="default">
    <config-set ref="default" name="All" build-skills="true">
      <config-choice type="effects" link="default_effects"/>
      <config-choice type="capacities" link="default_capacities"/>
      <config-choice type="stats" link="default_stats"/>
      <config-choice type="skills" link="_ALL_"/>
      <config-choice type="meta-qualities" link="_ALL_"/>
      <config-choice type="archetypes" link="_ALL_"/>
      <config-choice type="modifiers" link="_ALL_"/>
      <config-choice type="powers" link="_ALL_"/>
      <config-choice type="character" link="default_character"/>
      <config-choice type="tables" link="default_tables"/>
    </config-set>
  </config-sets>

  <config-chooser type="effects">
    <effects ref="default_effects">
      <effect type="stat" name="Stat" cost="4"/>
      <effect type="skill" name="Build" cost="0"/>
      <effect type="skill" name="Standard" cost="1"/>
      <effect type="power" name="Attacks" cost="2"/>
      <effect type="power" name="Defends" cost="2"/>
      <effect type="power" name="Useful" cost="2" special-required="true"/>
      <effect type="power" name="Dud" cost="1" special-required="true"/>
      <effect type="willpower-base" name="Base Willpower" cost="3"/>
      <effect type="willpower" name="Willpower" cost="1"/>
      <effect type="modifier" name="Custom Modifier" cost="0"/>
    </effects>
  </config-chooser>

  <config-chooser type="capacities">
    <capacities ref="default_capacities">
      <capacity type="power" name="Mass" mod="2"/>
      <capacity type="power" name="Range" mod="2"/>
      <capacity type="power" name="Speed" mod="2"/>
      <capacity type="power" name="Touch" mod="1"/>
      <capacity type="power" name="Self" mod="2"/>
      <capacity type="Body" name="Lift" mod="0"/>
      <capacity type="Body" name="Throw" mod="0"/>
      <capacity type="Body" name="Damage" mod="0"/>
      <capacity type="Body" name="Sprint" mod="0"/>
      <capacity type="Body" name="Long Jump" mod="0"/>
      <capacity type="Body" name="High Jump" mod="0"/>
    </capacities>
  </config-chooser>

  <config-chooser type="stats">
    <pools type="stats" ref="default_stats">
      <pool name="">
        <effects>
          <effect type="stat" name="Body" cost="4"/>
        </effects>
      </pool>
      <pool name="">
        <effects>
          <effect type="stat" name="Coordination" cost="4"/>
        </effects>
      </pool>
      <pool name="">
        <effects>
          <effect type="stat" name="Sense" cost="4"/>
        </effects>
      </pool>
      <pool name="">
        <effects>
          <effect type="stat" name="Mind" cost="4"/>
        </effects>
      </pool>
      <pool name="">
        <effects>
          <effect type="stat" name="Charm" cost="4"/>
        </effects>
      </pool>
      <pool name="">
        <effects>
          <effect type="stat" name="Command" cost="4"/>
        </effects>
      </pool>
    </pools>
  </config-chooser>

  <config-chooser type="skills">
    <pools type="skills" ref="wild_talents_skills" name="Wild Talents">
      <pool name="">
        <effects>
          <effect type="skill" cost="1" name="Athletics" link="Body" special-required="true" book="WT2E"/>
        </effects>
      </pool>
      <pool name="">
        <effects>
          <effect type="skill" cost="1" name="Block" link="Body" book="WT2E"/>
        </effects>
      </pool>
      <pool name="">
        <effects>
          <effect type="skill" cost="1" name="Brawling" link="Body" book="WT2E"/>
        </effects>
      </pool>
      <pool name="">
        <effects>
          <effect type="skill" cost="1" name="Endurance" link="Body" book="WT2E"/>
        </effects>
      </pool>
      <pool name="">
        <effects>
          <effect type="skill" cost="1" name="Melee Weapon" link="Body" special-required="true" book="WT2E"/>
        </effects>
      </pool>
      <pool name="">
        <effects>
          <effect type="skill" cost="1" name="Dodge" link="Coordination" book="WT2E"/>
        </effects>
      </pool>
      <pool name="">
        <effects>
          <effect type="skill" cost="1" name="Driving" link="Coordination" special-required="true" book="WT2E"/>
        </effects>
      </pool>
      <pool name="">
        <effects>
          <effect type="skill" cost="1" name="Ranged Weapon" link="Coordination" special-required="true" book="WT2E"/>
        </effects>
      </pool>
      <pool name="">
        <effects>
          <effect type="skill" cost="1" name="Stealth" link="Coordination" book="WT2E"/>
        </effects>
      </pool>
      <pool name="">
        <effects>
          <effect type="skill" cost="1" name="Empathy" link="Sense" book="WT2E"/>
        </effects>
      </pool>
      <pool name="">
        <effects>
          <effect type="skill" cost="1" name="Perception" link="Sense" book="WT2E"/>
        </effects>
      </pool>
      <pool name="">
        <effects>
          <effect type="skill" cost="1" name="Scrutiny" link="Sense" book="WT2E"/>
        </effects>
      </pool>
      <pool name="">
        <effects>
          <effect type="skill" cost="1" name="First Aid" link="Mind" book="WT2E"/>
        </effects>
      </pool>
      <pool name="">
        <effects>
          <effect type="skill" cost="1" name="Knowledge" link="Mind" special-required="true" book="WT2E"/>
        </effects>
      </pool>
      <pool name="">
        <effects>
          <effect type="skill" cost="1" name="Language" link="Mind" special-required="true" book="WT2E"/>
        </effects>
      </pool>
      <pool name="">
        <effects>
          <effect type="skill" cost="1" name="Medicine" link="Mind" book="WT2E"/>
        </effects>
      </pool>
      <pool name="">
        <effects>
          <effect type="skill" cost="1" name="Navigation" link="Mind" book="WT2E"/>
        </effects>
      </pool>
      <pool name="">
        <effects>
          <effect type="skill" cost="1" name="Research" link="Mind" book="WT2E"/>
        </effects>
      </pool>
      <pool name="">
        <effects>
          <effect type="skill" cost="1" name="Security Systems" link="Mind" book="WT2E"/>
        </effects>
      </pool>
      <pool name="">
        <effects>
          <effect type="skill" cost="1" name="Streetwise" link="Mind" book="WT2E"/>
        </effects>
      </pool>
      <pool name="">
        <effects>
          <effect type="skill" cost="1" name="Survival" link="Mind" book="WT2E"/>
        </effects>
      </pool>
      <pool name="">
        <effects>
          <effect type="skill" cost="1" name="Tatics" link="Mind" book="WT2E"/>
        </effects>
      </pool>
      <pool name="">
        <effects>
          <effect type="skill" cost="1" name="Lie" link="Charm" book="WT2E"/>
        </effects>
      </pool>
      <pool name="">
        <effects>
          <effect type="skill" cost="1" name="Performance" link="Charm" special-required="true" book="WT2E"/>
        </effects>
      </pool>
      <pool name="">
        <effects>
          <effect type="skill" cost="1" name="Persuasion" link="Charm" book="WT2E"/>
        </effects>
      </pool>
      <pool name="">
        <effects>
          <effect type="skill" cost="1" name="Interrogation" link="Command" book="WT2E"/>
        </effects>
      </pool>
      <pool name="">
        <effects>
          <effect type="skill" cost="1" name="Intimidation" link="Command" book="WT2E"/>
        </effects>
      </pool>
      <pool name="">
        <effects>
          <effect type="skill" cost="1" name="Leadership" link="Command" book="WT2E"/>
        </effects>
      </pool>
      <pool name="">
        <effects>
          <effect type="skill" cost="1" name="Stability" link="Command" book="WT2E"/>
        </effects>
      </pool>
    </pools>

    <pools type="skills" ref="kerberos_club_build_skills" name="Kerberos Club">
      <!-- Basic Skills KC -->
      <pool name="">
        <effects>
          <effect type="skill" cost="0" name="Boxing" link="Body" book="KC"/>
        </effects>
      </pool>
      <pool name="">
        <effects>
          <effect type="skill" cost="0" name="Lifting" link="Body" book="KC"/>
        </effects>
      </pool>
      <pool name="">
        <effects>
          <effect type="skill" cost="0" name="Running" link="Body" book="KC"/>
        </effects>
      </pool>
      <pool name="">
        <effects>
          <effect type="skill" cost="0" name="Sports" link="Body" book="KC"/>
        </effects>
      </pool>
      <pool name="">
        <effects>
          <effect type="skill" cost="0" name="Wrestling" link="Body" book="KC"/>
        </effects>
      </pool>
      <pool name="">
        <effects>
          <effect type="skill" cost="0" name="Acrobatics" link="Coordination" book="KC"/>
        </effects>
      </pool>
      <pool name="">
        <effects>
          <effect type="skill" cost="0" name="Archery" link="Coordination" book="KC"/>
        </effects>
      </pool>
      <pool name="">
        <effects>
          <effect type="skill" cost="0" name="Climb" link="Coordination" book="KC"/>
        </effects>
      </pool>
      <pool name="">
        <effects>
          <effect type="skill" cost="0" name="Dodge" link="Coordination" book="KC"/>
        </effects>
      </pool>
      <pool name="">
        <effects>
          <effect type="skill" cost="0" name="Evasion" link="Coordination" book="KC"/>
        </effects>
      </pool>
      <pool name="">
        <effects>